id,title,score,num_comments,author,created_utc,url,over_18,edited,spoiler,stickied
1gvq9rn,Thoughts on EcZachly/Zach Wilson's free YouTube bootcamp for data engineers?,65,130,battaakkhhhh,2024-11-20 14:06:52,https://www.reddit.com/r/dataengineering/comments/1gvq9rn/thoughts_on_eczachlyzach_wilsons_free_youtube/,False,False,False,False
1gvyzee,Tech jobs are mired in a recession,40,19,Penta55,2024-11-20 20:12:49,https://www.businessinsider.com/white-collar-recession-hiring-slump-jobs-tech-industry-applications-rejection-2024-11?utm_source=linkedin&utm_medium=social&utm_campaign=business-author-post,False,False,False,False
1gvsvj3,Please help me blow through the smoke: what is a semantic layer?,35,27,dadadawe,2024-11-20 16:03:37,https://www.reddit.com/r/dataengineering/comments/1gvsvj3/please_help_me_blow_through_the_smoke_what_is_a/,False,False,False,False
1gvorij,My business wants a datalake... Need some advice,33,34,WillowSide,2024-11-20 12:50:57,https://www.reddit.com/r/dataengineering/comments/1gvorij/my_business_wants_a_datalake_need_some_advice/,False,False,False,False
1gvirwf,How much would you charge monthly to own a basic ETL in maintenance mode as a consultant?,31,18,SeaVeterinarian9204,2024-11-20 05:52:25,https://www.reddit.com/r/dataengineering/comments/1gvirwf/how_much_would_you_charge_monthly_to_own_a_basic/,False,False,False,False
1gvr4k5,Is Data Engineering  basically construction of ETL Pipelines?,21,25,RightSell6234,2024-11-20 14:47:16,https://www.reddit.com/r/dataengineering/comments/1gvr4k5/is_data_engineering_basically_construction_of_etl/,False,False,False,False
1gvnta1,Changing company as a Data Engineer?,8,1,Irachar,2024-11-20 11:57:39,https://www.reddit.com/r/dataengineering/comments/1gvnta1/changing_company_as_a_data_engineer/,False,False,False,False
1gvx98w,a tool that deterministically finds joins ,6,27,thelionofverdun,2024-11-20 19:02:32,https://www.reddit.com/r/dataengineering/comments/1gvx98w/a_tool_that_deterministically_finds_joins/,False,False,False,False
1gvli60,What is a good job to find before pursuing data science and data engineering?,8,3,semenpai,2024-11-20 09:11:26,https://www.reddit.com/r/dataengineering/comments/1gvli60/what_is_a_good_job_to_find_before_pursuing_data/,False,False,False,False
1gvglxq,Do We Really Need Warehouse-Native Apps? Let’s Talk,7,12,finally_i_found_one,2024-11-20 03:47:36,https://www.reddit.com/r/dataengineering/comments/1gvglxq/do_we_really_need_warehousenative_apps_lets_talk/,False,False,False,False
1gw0ns1,Power BI and Analytics as Code?,3,3,Hegirez,2024-11-20 22:05:12,https://www.reddit.com/r/dataengineering/comments/1gw0ns1/power_bi_and_analytics_as_code/,False,False,False,False
1gvz8q3, Internal Training Program & Sandbox Environments ,3,1,Big_E_Jones,2024-11-20 20:28:03,https://www.reddit.com/r/dataengineering/comments/1gvz8q3/internal_training_program_sandbox_environments/,False,False,False,False
1gvodec,Achieving Auto Partition Reassignment in Kafka Without Cruise Control,3,0,wanshao,2024-11-20 12:29:28,https://www.reddit.com/r/dataengineering/comments/1gvodec/achieving_auto_partition_reassignment_in_kafka/,False,False,False,False
1gvz8u0,Advice regarding table backup logic,2,1,_mspoopybutthole_,2024-11-20 20:28:24,https://www.reddit.com/r/dataengineering/comments/1gvz8u0/advice_regarding_table_backup_logic/,False,False,False,False
1gvtgko,What’s the difference between [Software] Observability and Data Observability?,2,2,boss_yaakov,2024-11-20 16:28:42,https://www.reddit.com/r/dataengineering/comments/1gvtgko/whats_the_difference_between_software/,False,False,False,False
1gvscax,Exploring the Semantic Layer Through the Lens of MVC,2,0,sspaeti,2024-11-20 15:40:39,https://cube.dev/blog/exploring-the-semantic-layer-through-the-lens-of-mvc,False,False,False,False
1gvqr6m,Rescue and edit some lonely .hive files? (Apache Hive?),2,5,dykaba,2024-11-20 14:29:55,https://www.reddit.com/r/dataengineering/comments/1gvqr6m/rescue_and_edit_some_lonely_hive_files_apache_hive/,False,False,False,False
1gvmnjq,Seeking experts for guidance,2,4,Tango_D,2024-11-20 10:40:47,https://www.reddit.com/r/dataengineering/comments/1gvmnjq/seeking_experts_for_guidance/,False,False,False,False
1gvmdun,Does this description seem accurate to everyone?,2,1,Head_Sort8789,2024-11-20 10:20:39,https://www.reddit.com/r/dataengineering/comments/1gvmdun/does_this_description_seem_accurate_to_everyone/,False,False,False,False
1gw69yr,Opinions on doing a Master’s degree in Data Science as a health professional with no experience in this field.,2,0,No_Bed726,2024-11-21 03:02:26,https://www.reddit.com/r/dataengineering/comments/1gw69yr/opinions_on_doing_a_masters_degree_in_data/,False,False,False,False
1gw6658,Need some perspective,1,0,Crow2525,2024-11-21 02:57:13,https://www.reddit.com/r/dataengineering/comments/1gw6658/need_some_perspective/,False,False,False,False
1gw24dv,Looking for Data Sources to Model Football Match Results,1,1,TimelyPath2560,2024-11-20 23:47:53,https://www.reddit.com/r/dataengineering/comments/1gw24dv/looking_for_data_sources_to_model_football_match/,False,False,False,False
1gvynp0,Resource for plsql,1,1,CrazyDiscussion3415,2024-11-20 19:59:52,https://www.reddit.com/r/dataengineering/comments/1gvynp0/resource_for_plsql/,False,False,False,False
1gvyitr,Best Practices for Structuring an ETL Pipeline with Databricks Medallion Architecture,1,0,spaceape__,2024-11-20 19:54:17,https://www.reddit.com/r/dataengineering/comments/1gvyitr/best_practices_for_structuring_an_etl_pipeline/,False,False,False,False
1gvxn7e,Advice on Saving Compute Resource - Fabric,1,2,420alphabravo,2024-11-20 19:18:18,https://www.reddit.com/r/dataengineering/comments/1gvxn7e/advice_on_saving_compute_resource_fabric/,False,False,False,False
1gvx7dx,"Supercharge Your Coding Workflow in VS Code, Cline and Claude",1,0,ivanovyordan,2024-11-20 19:00:37,https://datagibberish.com/p/generating-code-with-claude-and-cline,False,False,False,False
1gvvmts,Ideas for remote but on site jobs? ,1,0,soggyGreyDuck,2024-11-20 17:57:03,https://www.reddit.com/r/dataengineering/comments/1gvvmts/ideas_for_remote_but_on_site_jobs/,False,False,False,False
1gvo3hz,Can machine learning predict motor overheating? 🌡️⚡,0,8,JJZ124434,2024-11-20 12:14:32,https://i.redd.it/419a8yp2t12e1.jpeg,False,False,False,False
1gvhzr3,Involvement in Database Management/Development ,1,5,mhkk93,2024-11-20 05:04:50,https://www.reddit.com/r/dataengineering/comments/1gvhzr3/involvement_in_database_managementdevelopment/,False,False,False,False
1gw1i3t,Is it possible to land a junior position as 34 years old?,0,18,Brinell0,2024-11-20 23:14:25,https://www.reddit.com/r/dataengineering/comments/1gw1i3t/is_it_possible_to_land_a_junior_position_as_34/,False,False,False,False
1gw03r5,Is data quality still a real problem?,0,14,FirefoxMetzger,2024-11-20 21:34:44,https://www.reddit.com/r/dataengineering/comments/1gw03r5/is_data_quality_still_a_real_problem/,False,False,False,False
